rating,title,text,images,asin,parent_asin,user_id,timestamp,helpful_vote,verified_purchase
4.0,Best phone for those of us that that hate the iPhone X designs,"Great phone, good used value. Front glass is perfect, back has some scratches. Fully functional. Battery health was at 91%, yours may differ.","[{'small_image_url': 'https://images-na.ssl-images-amazon.com/images/I/61369RCxNsL._SL256_.jpg', 'medium_image_url': 'https://images-na.ssl-images-amazon.com/images/I/61369RCxNsL._SL800_.jpg', 'large_image_url': 'https://images-na.ssl-images-amazon.com/images/I/61369RCxNsL.jpg', 'attachment_type': 'IMAGE'}, {'small_image_url': 'https://images-na.ssl-images-amazon.com/images/I/61LktMuby5L._SL256_.jpg', 'medium_image_url': 'https://images-na.ssl-images-amazon.com/images/I/61LktMuby5L._SL800_.jpg', 'large_image_url': 'https://images-na.ssl-images-amazon.com/images/I/61LktMuby5L.jpg', 'attachment_type': 'IMAGE'}, {'small_image_url': 'https://images-na.ssl-images-amazon.com/images/I/61Q3LBz8eDL._SL256_.jpg', 'medium_image_url': 'https://images-na.ssl-images-amazon.com/images/I/61Q3LBz8eDL._SL800_.jpg', 'large_image_url': 'https://images-na.ssl-images-amazon.com/images/I/61Q3LBz8eDL.jpg', 'attachment_type': 'IMAGE'}]",B07B9LWLR7,B07B9LWLR7,AFNALPGKGHTYVGTUKNIJCU4Y5OKQ,1561179996501,3,True
5.0,It’s a great phone,I was so surprised that this phone turned out to be great and worth my money. It has no problem and it came perfect.,"[{'small_image_url': 'https://images-na.ssl-images-amazon.com/images/I/61TuPEx0aaL._SL256_.jpg', 'medium_image_url': 'https://images-na.ssl-images-amazon.com/images/I/61TuPEx0aaL._SL800_.jpg', 'large_image_url': 'https://images-na.ssl-images-amazon.com/images/I/61TuPEx0aaL.jpg', 'attachment_type': 'IMAGE'}, {'small_image_url': 'https://images-na.ssl-images-amazon.com/images/I/61gfvft4y4L._SL256_.jpg', 'medium_image_url': 'https://images-na.ssl-images-amazon.com/images/I/61gfvft4y4L._SL800_.jpg', 'large_image_url': 'https://images-na.ssl-images-amazon.com/images/I/61gfvft4y4L.jpg', 'attachment_type': 'IMAGE'}, {'small_image_url': 'https://images-na.ssl-images-amazon.com/images/I/815EkaM9TLL._SL256_.jpg', 'medium_image_url': 'https://images-na.ssl-images-amazon.com/images/I/815EkaM9TLL._SL800_.jpg', 'large_image_url': 'https://images-na.ssl-images-amazon.com/images/I/815EkaM9TLL.jpg', 'attachment_type': 'IMAGE'}]",B07B9LWLR7,B07B9LWLR7,AFYQXWRQ3YUUFF5EVJPWWGIYCTIA,1560764206776,1,True
5.0,Five Stars,Best cell phone on the market.  I love it!,[],B00NQHZ2RU,B00NQHZ2RU,AECQL7Y62UK2P2K7V2IYHEXR3YGA,1471422511000,0,True
5.0,The prire is right,I like iPhone 6 Plus gold color because is right on my pocket and reasonable prire<br />But this phone have problem with internet<br />What this do stop internet ( froson)<br />That computing me should I return but I bought for 50 days<br />ThankYou<br />HoangNguyen<br />702-504-0542<br />Thebay101prowong@gmail.com,"[{'small_image_url': 'https://images-na.ssl-images-amazon.com/images/I/51O8x6oSTcL._SL256_.jpg', 'medium_image_url': 'https://images-na.ssl-images-amazon.com/images/I/51O8x6oSTcL._SL800_.jpg', 'large_image_url': 'https://images-na.ssl-images-amazon.com/images/I/51O8x6oSTcL._SL1600_.jpg', 'attachment_type': 'IMAGE'}]",B00NQHZ2RU,B00NQHZ2RU,AHELOLOKZJEERHQ2I57HVPVTFDWA,1527838530676,0,True
5.0,Five Stars,my wife love it,[],B00NQHZ2RU,B00NQHZ2RU,AG5NLKUNSVJ2H2ADQG3UJ4ZWHLAQ,1467913005000,0,True
1.0,Bad don’t waste your time,Bad,[],B00NPY1G56,B00NPY1G56,AGDL7QSRS3ZS7N47YIHQRR7GOZVQ,1544835907899,0,True
3.0,"THAT IT WAS AN IPHONE 6 PLUS 128GB, BUT ...","THAT IT WAS AN IPHONE 6 PLUS 128GB , BUT THE CHARGE IS VERY SLOW , AND TAKES TOO LONG TO GET A FEW BARS. I WILL TRY TO GET AN ORIGINAL CHARGER .",[],B00NQHZ2RU,B00NQHZ2RU,AHBLUCXOBHCEXFP3X6JPAACB637A,1519488800186,0,True
1.0,Be careful,Phone stop working after a week.,[],B00NQHZ2RU,B00NQHZ2RU,AFNG7LHCYWBJH4CEOPVEYMIDNGQA,1467248498000,1,True
5.0,Five Stars,I'n very happy with the it,[],B00NQHZ2RU,B00NQHZ2RU,AHWZ6L5Q35EULAG5YGJMC7SKF6OQ,1455399472000,0,True
4.0,Four Stars,Brand new iphone very happy with it,[],B00NQHZ2RU,B00NQHZ2RU,AE4Z6KP4UY37FWFS33ZC5UZP3QSA,1463701631000,0,True
5.0,Five Stars,"Phone Is Great, 128gb Of Storage. I Would Recommend Seller QuickNShip",[],B00NQHZ2RU,B00NQHZ2RU,AHW5N2N7PDDCZQXDDUTRNKT57J2Q,1453662301000,0,True
5.0,Five Stars,PERFECT PHONE!! ❤️,[],B00NQHZ2RU,B00NQHZ2RU,AGAKAXLSF5DQFWYXIWJE5AHW5R2A,1501111911104,1,True
5.0,Five Stars,"Great phone, great shipping",[],B00NQHZ2RU,B00NQHZ2RU,AF5TCVFLN3SPSNZ5ZYRY4TBA5CSQ,1454811658000,0,True
5.0,Five Stars,A+++ seller,[],B00NQHZ2RU,B00NQHZ2RU,AHV7PXWSM5AETBNROA42KBGIIJPA,1417810183000,0,True
1.0,Bad business for Amazon reputation,"Don't buy this phone it's always  freezing. I lost $370 on this phone and it doesn't work. Bad business for Amazon reputation, please don't buy from this seller.",[],B00NQHZ2RU,B00NQHZ2RU,AHRDREQ7CI5MFFJKC43JAUXO5KRA,1502423949581,2,True
5.0,Apple IPhone 6plus Review,Currently living overseas in Brazil and when the time came to take vacation stateside I decided it was time to upgrade my IPhone4 to the Iphone6 plus. I'm very pleased with the upgrade with no complaints noted.,"[{'small_image_url': 'https://images-na.ssl-images-amazon.com/images/I/41FeBXLJTxL._SL256_.jpg', 'medium_image_url': 'https://images-na.ssl-images-amazon.com/images/I/41FeBXLJTxL._SL800_.jpg', 'large_image_url': 'https://images-na.ssl-images-amazon.com/images/I/41FeBXLJTxL._SL1600_.jpg', 'attachment_type': 'IMAGE'}]",B00NQHZ2RU,B00NQHZ2RU,AECFKA5AJZLS5YALS2WK5UED4XDA,1468532071000,5,True
5.0,Five Stars,"The box contain every things they say,<br />except the key for the sim card slot.",[],B00NQHZ2RU,B00NQHZ2RU,AH6DWTXXDXGKYXDQ2HJS7MWYIHXQ,1471387877000,0,True
5.0,Iphone 6+,It is in good condition and it's worth its cost,[],B00NQHZ2RU,B00NQHZ2RU,AGI677LOY7E4IUGZYA3DSYWCVWGQ,1446311692000,0,True
2.0,mind you the iphone is a extremely good phone needless to say i have an iphone 4 ...,"i am sorry but i think i was dupe by the information posted on this phone. if i had known i would have second thoughrs, mind you the iphone is a extremely good phone needless to say i have an iphone 4 and a 3 and i never had any problems. this phone is constantly freezing, have to shut down and restart, constantly have to do factory restore to little avail.",[],B00NQHZ2RU,B00NQHZ2RU,AGCW6EJEJFWMALHT4NYU53KGGTKQ,1475531609000,2,True
5.0,Perfect. Exactly what I wanted,This phone is exactly what I wanted. Thanks for not screwing me out of my money!!,[],B00NQHZ2RU,B00NQHZ2RU,AHYKHDLYEDJWF7QF5XV4SXMVFHZA,1459742049000,0,True
1.0,Could not activate even though unlocked,"While this product worked well on wifi, it could not stay connected for cell service. If it would not work at all, even though it was unlocked, or it would work for a few hours and then say ""searching"". I tired several carriers and they either could not get it to connect to the tower, or it would only stay connected until it turned off, then would not come back.  Very disappointed with this product.<br />Took it to several repair shops for an estimate and they all said it's a common problem with this phone and not worth the price to fix.",[],B00NQHZ2RU,B00NQHZ2RU,AE4VMD2CUOHSVDK3NCPJNZ4HAFDA,1566929842726,0,True
1.0,Internal screan is messed up!,"Fast shipping, phone felt twice as light as one from att, I don't know if this phone was used or not but the screens is going out so I can only unlock it 1/10 times and can't click on things because screan is glitchy",[],B00NQHZ2RU,B00NQHZ2RU,AEVTXOHHOKIC6Z7SLWE23Q2XUXOA,1509825033443,1,True
1.0,AVOID. AVOID. AVOID.,"I bought this exact model directly from the Apple online Store. Brand new, less than 30 days ago. Got this for a close friend. A major problem is that whenever she calls, no one can hear her. I researched this on the internet, and many have this same problem. We are about to take out the Simm chip from the iPhone 8 plus -- and put it back into an old iPhone 6s Plus.  Imagine how arrogant Apple is. That a customer has to return to a phone THREE YEARS OLD -- to get better service -- than a brand NEW iPhone. What a company Tim Cook runs. Horribly embarrassing to Apple,",[],B075NVNBCW,B075NVNBCW,AEGS7NFWG42R75GUGYC7HMSOU66A,1520085240392,12,False
5.0,Great phone,Would buy again,[],B07759SBP7,B07759SBP7,AFAY66EYY4YO3KOC4PKD5KFC3DIQ,1567833553070,0,True
5.0,iPhone 8plus,I love the way it looks,[],B081MCRQG3,B081MCRQG3,AFHXIKMGQWUFVDWSUHD27ZBNKHHA,1592772171331,0,True
5.0,Great phone! Amazing camera!, ,"[{'small_image_url': 'https://m.media-amazon.com/images/I/61eMegdC8kL._SL256_.jpg', 'medium_image_url': 'https://m.media-amazon.com/images/I/61eMegdC8kL._SL800_.jpg', 'large_image_url': 'https://m.media-amazon.com/images/I/61eMegdC8kL._SL1600_.jpg', 'attachment_type': 'IMAGE'}, {'small_image_url': 'https://m.media-amazon.com/images/I/810UIUutjNL._SL256_.jpg', 'medium_image_url': 'https://m.media-amazon.com/images/I/810UIUutjNL._SL800_.jpg', 'large_image_url': 'https://m.media-amazon.com/images/I/810UIUutjNL._SL1600_.jpg', 'attachment_type': 'IMAGE'}]",B09JFC967X,B09JFC967X,AE2FYI43LE4XXL3HIWAGX7OOSP3Q,1672161207225,2,True
4.0,Can’t unlock the phone,"I have had this phone for 2 years now. It works great, sometimes the screen freezes, but it’s probably because I use it too much. When I want to open a few specific apps, the phone immediately logs me out of them and closes the app. May be that the phone is pretty old by the IPhone standards.<br /><br /> The only real issue I have is that it’s not unlocked meaning that every time I go abroad, I can’t use foreign SIM cards. This issue needs to be resolved. I followed all steps to log in to my att, but it says my account doesn’t exist and it’s not an ATT phone. If I decide to move abroad, this phone is going to be useless.",[],B072KFCKYH,B072KFCKYH,AFT3RG65DL4GPSGTV2RVVE7ZMDLQ,1607016347915,0,True
1.0,AMAZON PRIME NO FUNCIONA,"No recibí el producto, Amazon Prime no sirve.",[],B09JF5ZHQS,B09JF5ZHQS,AHW42CL5C6B2ULM62SDQCTCFIMAA,1677508563111,0,True
1.0,No features,"No single features came with the phone and every applications must be paid for before you can download from apple store, including Google Chrome.",[],B078P38R8L,B078P38R8L,AEQLTLJTWDES7AJXWYI6Z76DOBFQ,1652056723581,0,True
1.0,No features,"No single features came with the phone and every applications must be paid for before you can download from apple store, including Google Chrome.",[],B078P38R8L,B078P38R8L,AEQLTLJTWDES7AJXWYI6Z76DOBFQ,1652056723581,0,True
4.0,Where's the battery new?,The battery doesn't last all day I don't believe it was a new battery.,[],B07759SBP7,B07759SBP7,AH7BJTDOCSQXTFUYPMPS6AUZI6KQ,1574904899302,0,True
5.0,Very Good iphone 13 UNLOCKED phone,"No problems with this phone, it's perfect & well worth the money!!",[],B0B5FLX9WS,B0B5FLX9WS,AE37VTK6CXAVRZKJQM3Q4YGT3VYA,1681909055465,0,True
5.0,Better than expected,"Had a slight issue with UPS delivering to the wrong address but that wasn't the sellers fault. In fact I immediately reach out to them when the package wasn't at my home and they were ready to help if needing to file a claim. After retreiving my package from the neighbors house, I was able to present this to my daughter for her birthday which was an upgrade from her iphone 7. She is so happy and loves the phone.",[],B08TFHC17C,B08TFHC17C,AEQANSENTPPSSGLKXFT4OPIV7ZSQ,1658060013098,0,True
4.0,good product,Good product would recommend to others,[],B09JF5ZHQS,B09JF5ZHQS,AFR43QIWIH2WV5JKDUH43PRHJHNQ,1660579548241,2,True
5.0,iPhone 8,El teléfono está bonito pero parece que no le dura mucho la carga de la batería,[],B07759SBP7,B07759SBP7,AEJQ2JSVVNBWJJODBFBJD4WEXXCQ,1618284808965,0,True
5.0,"Llego en excelente estado, ningún daño, batería al 90% y el despacho fue rápido, excelente compra.",Muy buen producto.,[],B09JF5ZHQS,B09JF5ZHQS,AEXQ3CO26ZBCWLYIQRNFYFV33I2A,1675609994678,1,True
5.0,Good purchase!!!,Great refurbished iPhone. Even came with screen protector already on it. I am more than happy with my purchase. Will definitely buy refurbished phone through Amazon again 🙂,[],B07759SBP7,B07759SBP7,AHE47Q7IRWX7FVNMBQDATN2GWSEA,1615996826424,0,True
1.0,BlueMarble Mobiles listed phone incorrectly,"Phone did not work on Verizon, only AT&T, seller listed incorrectly as a Verizon phone. This was a Christmas present for our daughter. We ended up buying a different phone from Verizon, spent more money, barely got in time for Christmas. Seller did respond to my message with ""No problem, just return phone"". Great, that didn't help!",[],B074F4HMSY,B074F4HMSY,AH37VZ46L5RXRM3COA5H6TV4353Q,1546468148278,0,True
1.0,very disappointed,Was locked and can't return due to a label to send back..very disappointed,[],B004YRBM1Q,B004YRBM1Q,AGUA6RZZMMHPDFI7EB4JXUPIOCAQ,1487420347000,0,True
5.0,Bueno bonito y barato,Se ve nuevo trabaja como nuevo y sobre todo el precio un regalo,[],B07759SBP7,B07759SBP7,AEWBKM64VTJNJXDTEVLIDK7HTXKQ,1682096266749,1,True
5.0,Happy customer,I am very pleased with my iPhone 8 Plus. I upgraded from an iPhone 6s. My old phone obviously had battery problems and I had to charge it several times during the day. I have not had to change this one until evening or bedtime. I am happy with the price. I like the size of the phone as well. I am definitely a happy customer!,[],B07759SBP7,B07759SBP7,AFGKLWDC2ZYO6RLXE4KJ27ETJIBQ,1614260030696,0,True
1.0,Defectuoso,Salió defectuoso. No sirve el touch de la pantalla,[],B00NPY1G56,B00NPY1G56,AGQSDG22N6PII6LE7N3ZVJRMPRPQ,1530716692108,0,True
2.0,iPhone,I’m trying to get in contact with the seller,[],B00NPY1G56,B00NPY1G56,AHDJY6E4BQKWKMF4HT3I37P2OZDQ,1546027038084,0,True
1.0,Speakers nearly Dead,"Phone’s speakers barely work, product was not properly tested.",[],B07759SBP7,B07759SBP7,AHLEAIDXWBUG3YVFBT3P3OBNRT2A,1620974293510,1,True
1.0,Don’t buy,"The camera didn’t work, took it to try and fix it and the repairer stated it was a mother board issue after waiting 2 weeks for the phone to be replaced, trying to give the benefit of the doubt I just went on ahead and requested a full refund! How could you sell inoperable phones???",[],B00NPY1G56,B00NPY1G56,AHKBYTTAFNI2YLO37KBM573WYEUQ,1536116206825,0,True
5.0,Nice phone but scene too small for me.  Needed pro max.,Battery seems to last short time,[],B09JFS4P67,B09JFS4P67,AFBMS4OOX46E3THL72765CGOFAUA,1680435750291,0,True
5.0,Wow! It’s virtually brand new!,They aren’t kidding when they labeled this Renewed Premium. This phone has only a couple slight scratches that you can’t see unless you hold it up to your face. The battery life is 100%. The screen is perfect. What else could you want??,[],B09JFMBNPH,B09JFMBNPH,AET4WRAUJFBBEX2YZ7RWUWUYLZDQ,1669150071938,1,True
5.0,Excelente,Buen producto,[],B07759SBP7,B07759SBP7,AGG2HGXCGDEZBNB7RJZF4UDF35HA,1680573539368,1,True
5.0,Good deal,Good deal,[],B07759SBP7,B07759SBP7,AHWRGV5N7CUUTKPDRYJLPUY7CEOQ,1576191280314,0,True
5.0,"Great phone, I love it","All was great the phone came in perfect condition, it works great was delivered on time, I am very please and recommend widely this seller I am happy wit my 8 plus iPhone 👊🏼",[],B082MRWDKN,B082MRWDKN,AFML5VLO2SG6WPOU42QKWCTTC7TQ,1609795519615,0,True
5.0,Wonderful phone and a wonderful shopping experience,Exactly as described. Wonderful phone and a wonderful shopping experience.,[],B07CQNF813,B07CQNF813,AGVVGVO7R6HKRICQJPNSCSICMX5A,1533529903463,5,True
4.0,Battery life.,So far so good. I just have a question on the battery,[],B07234GKN5,B07234GKN5,AFSZPF6BUXLJ2YX3ZHERW5RS2CEQ,1559601992645,0,True
5.0,Great value,"Great condition!!<br /><br />Feb 2020, 1 year forward and works like new.",[],B07759SBP7,B07759SBP7,AEHCLUSK4434FQDWMCFYM2ZDBRMA,1550319271511,0,True
5.0,Value for money,"Value for money. Condition was "" As New""",[],B09JFC8JGG,B09JFC8JGG,AGLUGVBULPDMRBPFZBAE5WI6SN2Q,1684723793387,0,True
4.0,Too expensive.,"Too expensive, I’ve got another one better price.",[],B09JF5ZHQS,B09JF5ZHQS,AGH55GCKUXRIF6QNSVI2KEL6P3AQ,1654055024253,1,True
5.0,No problem at all with the phones!,The phone still works fine I didn’t want to write review until I make sure it’s working the way it’s supposed to and it is working fine thank you guys!! By the way I bought two of the to replace 6+s for me and my wife without singing a contact. Great products we are enjoying them!,[],B07CQNF813,B07CQNF813,AHTLSUQHWP52NNV46ZBG2Q5JNWCQ,1582601534341,0,True
5.0,Very Happy,I was very pleased with the condition of this phone. It looks and works like it’s brand new. I was happy with the fast shipping. Highly recommend this seller.,[],B081MCRQG3,B081MCRQG3,AH32UM3D6KUBZU23O6S3LSETD57Q,1580776268181,5,True
5.0,No issues with this refurbished device,No issues great phone so far!,[],B09JFNJ82P,B09JFNJ82P,AF6VNRKNCSVQ2AROKCBRX6FD2XIA,1653537985930,0,True
3.0,Not As Advertised,"Advertised as 80%+ battery, delivered a 77% battery. Phone kills itself on idle in less than a day. Amazon ""Renewed"" is spotty service repair at best.",[],B07759SBP7,B07759SBP7,AGGRLE5ZEN7W4LQMDSV4TETEYIDA,1649243377017,0,True
2.0,Doesn't function as a new phone,"I bought this iphone 8 in January 2020. It was described as renewed and would work and look like new.  There was problems with the sound initially.  Then, after just seven months, it started to continuously shut off, even with it being charged. Now it won't even turn on.",[],B078P38R8L,B078P38R8L,AEEXNZ3DDJBRG73PLRY5ZYKBDVPA,1597157464785,5,True
5.0,Awesome,Great,[],B07759SBP7,B07759SBP7,AGVY2423A4TV7ZVJIMF45FBDRS3A,1577933248440,0,True
5.0,decent phone for okayish price.,2nd renewed phone i've bought off of amazon. totally worth it.,[],B07B9LFNM9,B07B9LFNM9,AFQI7YBWNPJ4WJZAWE22JFOFH7FA,1559716611384,1,True
5.0,Refurbished iPhone 8 Plus,"Just bought this phone, seems to be working fine. I am watching to see if there’s any changes before the 90 days return policy.  I have been sold a lemon before and will not be happy if it happens again. So far it’s good quality.",[],B07759SBP7,B07759SBP7,AE47YCRLI5ZHG32V2VGN5HGYIE4A,1550194177182,1,True
5.0,Great refurbished iphone,"Writing this review from the iphone.  Great quality, no dents, no scratches, just as new!!!<br /><br />Will keep buying Amazon refurbished products in the future!!!",[],B09JFC8JGG,B09JFC8JGG,AECZI6HKMSGJBVX46LW23MNXQ3WA,1681475755809,0,True
5.0,Sound and Camera is Great!,"This was a gift, there are no regrets and no issues with cell phone. I recommend it!",[],B07759SBP7,B07759SBP7,AFENKKN56YH7P7KU2W5KRDE36X6A,1564630494510,0,True
4.0,"So far, impressive performance 🏋🏿",Overall performance so far is above my expectations. It’s worth the price I paid.✌🏿,[],B07759SBP7,B07759SBP7,AEGG6UQ2KFLMXNFXKYV4CNQN6T6A,1646276858684,0,True
4.0,Pudo ser mejor,Estaba en una condición muy buena pero no excelente ya que tiene un defecto en la pantalla casi imperceptible hasta que le colocas un vidrio templado.,"[{'small_image_url': 'https://m.media-amazon.com/images/I/71Y0eIXEJLL._SL256_.jpg', 'medium_image_url': 'https://m.media-amazon.com/images/I/71Y0eIXEJLL._SL800_.jpg', 'large_image_url': 'https://m.media-amazon.com/images/I/71Y0eIXEJLL._SL1600_.jpg', 'attachment_type': 'IMAGE'}, {'small_image_url': 'https://m.media-amazon.com/images/I/71mKYKgwoGL._SL256_.jpg', 'medium_image_url': 'https://m.media-amazon.com/images/I/71mKYKgwoGL._SL800_.jpg', 'large_image_url': 'https://m.media-amazon.com/images/I/71mKYKgwoGL._SL1600_.jpg', 'attachment_type': 'IMAGE'}]",B09JFC967X,B09JFC967X,AGVEHHSWQ4B7R7OZR7NGXHKXAHPQ,1674670840899,1,True
5.0,Works perfect,I’m happy,[],B09JFN8K6T,B09JFN8K6T,AGL7R7VBHD2VRW2OKJZEYDYYF54A,1664615322828,0,True
1.0,I read other peoples reviews before I got it and some are happy with their purchase,"Phone is glitchy.  Doesn't recognize when I'm touching it so I can't do anything with it.  No phone calls, reading emails, accessing face book, nothing. I read other peoples reviews before I got it and some are happy with their purchase, I'm  not.  I'm getting that's with these refurbished phones its a mixed bag of what you will get.  Russian roulette with your hard earned money. Good luck!",[],B00NPY1G56,B00NPY1G56,AFYJRAJFHNJW5PKB4V664CW6LCNA,1527600129870,1,True
5.0,Great purchase,Phone came like brand new..Also came two days early..So far so good..I would purchase from them again in near future..I got iPhone 8 Plus..worth every penny,[],B07759SBP7,B07759SBP7,AHUYBBKI22NV7WBXAUUHIGUBQFYQ,1614220271585,0,True
2.0,Two Stars,Speaker problem,[],B004YRBM1Q,B004YRBM1Q,AFRAGFPWPCZHRZGO24PFJUJU6DSA,1483386382000,0,True
1.0,One of wasn’t unlocked,One of them was locked,[],B07759SBP7,B07759SBP7,AFQB7WC55EWXMJFBWP3YDMZNM6CA,1625174854513,2,True
2.0,It’s fine,Arrived at zero power,[],B09JFP3R1D,B09JFP3R1D,AFMQQO2HBZN23X6BG4QO57VGLITA,1686000260313,0,True
5.0,Great phone!,Thanks. This is an awesome phone.,[],B081MCRQG3,B081MCRQG3,AEUNKBDDOJF45GXLMTF7AUQQVCGQ,1637571992833,0,True
5.0,Great phone!,Thanks. This is an awesome phone.,[],B081MCRQG3,B081MCRQG3,AEUNKBDDOJF45GXLMTF7AUQQVCGQ,1637571992833,0,True
4.0,Low battery life,The phone on the exterior was in almost new condition. Battery capacity was only 78%. Somehow I expected a little better battery capacity.,[],B07759SBP7,B07759SBP7,AEMV2UFEQWFA4BW6UVABJJDGTQAQ,1637259959940,1,True
5.0,I really like the size of the 8+ and I also love the camera,I really like the size of the 8+ and I also love the camera,[],B07B9LWLR7,B07B9LWLR7,AEFEYNHUKW4VZCCIRG2TGE2RCZLQ,1561960405018,0,True
5.0,Very happy with phone no scratch marks look like brand new,Satisfied with phone excellent condition,[],B07759SBP7,B07759SBP7,AFIEYMKA6PXEJ526ZVOCQH45W56Q,1602479047363,1,True
1.0,Defectuosos,Pedí 2 teléfonos de 256gb y me vino uno se 64 y uno de 256. En ambos no funcinaban los parlantes,[],B07759SBP7,B07759SBP7,AEIJ4LLQNPPBGKWZSCHDFVBNIKBA,1574604784063,1,True
3.0,Working great Thus far,"Looks and functions good so far. Seen a couple scuffs but nothing big. Price a little high, but it works,  sooooo can’t complain. :)",[],B07B9LFNM9,B07B9LFNM9,AF4HQTNV4B2HFUDEWK7IBH4BAVAA,1559173728061,0,True
3.0,Working great Thus far,"Looks and functions good so far. Seen a couple scuffs but nothing big. Price a little high, but it works,  sooooo can’t complain. :)",[],B07B9LFNM9,B07B9LFNM9,AF4HQTNV4B2HFUDEWK7IBH4BAVAA,1559173728061,0,True
5.0,Nice,My son love he phone,[],B072KFCKYH,B072KFCKYH,AHKQIHPKUVTPUXRE7K6XX7CBULKA,1616499666222,0,True
5.0,Amazing.,"This is the best purchase I could have ever made. I had an iPhone 6s (very ancient) with the battery life span of a deer getting hit by a semi-truck going 60 mph. I charge this phone 1 time a day compared to charging my 6s about 10 times a day. A 3ft charging cord and a very cheap, plastic adapter came in the box as well as a very cheap and breakable sd card remover tool. My only complaint with this phone is it doesn't have a headphone plug, I ended up buying a headphone jack adaptor. So if you have a very ancient phone like I did and are planning on buying this phone or a newer iPhone, it's probably best that you invest in a headphone jack. That is if you're a music enjoyer.<br />With that being said if you plan on purchasing this phone, you won't (or you'll hardly)be let down.",[],B09JF5ZHQS,B09JF5ZHQS,AHQ6DH4BDF3VB2DA426OR4U5KBYA,1683130152120,2,True
5.0,Hi,Hi,[],B085PXWRCN,B085PXWRCN,AHVSSFERW4PGXUS7WVSBUALUSZZQ,1585872497605,3,False
3.0,Battery health did not met standards of Premium Renewed,"I selected to pay extra for a ""premium renewed"" device specifically to ensure that my refurbished/renewed device would a have a battery health and capacity of 90% or better. The device I received has only 86% capacity which does NOT met the standards specified for a ""premium renewed"" device. The screen and camera lenses do seem to be in good condition or perhaps replaced. But this degree of battery health is unacceptable if paying the premium price. Not sure if I will be keeping this device, as it does not fulfill the order placed.",[],B09JFC8JGG,B09JFC8JGG,AGPLVXWH4GUV6E3H335N6I4MELKQ,1678508917820,3,True
5.0,Love it wasn’t to sure but so far so good ...,Love it wasn’t to sure but so far so good will write again in a month....easy to get connected with a carrier,[],B00NPY1G56,B00NPY1G56,AEAR52WNN222VC4S42BRAVJ2XXFA,1520394512488,1,True
2.0,Don’t buy it.,No original charger and no ear phone. I don’t suggest anyone to buy this product. No box either. It’s like a toy.,[],B078P38R8L,B078P38R8L,AGNB564FR6K3MFUJ4D7XCN6WI53A,1617666638519,1,True
5.0,Very satisfied,Everything is going well with the phone I ordered and it got delivered earlier than it was supposed to be. I would order from this company again.,[],B07234GKN5,B07234GKN5,AEZFU3STIFW2D3CSVMOU4OBXYBIA,1610320330516,0,True
5.0,Phone great shape works perfectly,Works great very good condition,[],B07B9LFNM9,B07B9LFNM9,AGDXLLGWIA33C3EPFOHCKK4DCGCA,1661020581770,1,True
5.0,Still great device,"Great like new condition. Simple to use, light to carry, if just need a simple great value device for day to day use, it still a great phone.",[],B07759SBP7,B07759SBP7,AG22HTKPDS4B7273OZH3AHJNBAPQ,1673577164381,0,True
5.0,Good delivery. Great product. Excellent business,Good delivery. Great product. Excellent business,[],B078P38R8L,B078P38R8L,AEISPIYVKSNPRMEP45KP26I26PJA,1681608106530,0,True
