rating,title,text,images,asin,parent_asin,user_id,timestamp,helpful_vote,verified_purchase
1.0,"Phone ordered claimed to be Unlocked, it was not unlocked",Phone was advertised to be unlocked. When I tried to setup up with Verizon it showed as being locked. The selling company did not respond to emails until the next day. All they said to do was return it. Seems like that would have been part of the refurbishing.,[],B0B5FLX9WS,B0B5FLX9WS,AFSAQZLP5LM55OB4LATQQA2EKF2Q,1671303406201,2,True
5.0,"Works great, no issues!",I have not had any issues with this phone. Definitely worth the money,[],B07759SBP7,B07759SBP7,AGRMXJLZXWX6HQV22DLEWIU4EP5A,1574602204519,0,True
5.0,EASE OF USE AND TRIPLE CAMERAS & VIDEO CAPABILITIES,"IPHONE 12 PRO EASY FOR BEGINNERS TO USE. HAD ASSISTANCE SETTING UP AND TRASFERING DATA FROM OLD PHONE SAMSUNG J7 WITH HELP OF SALES REP AT LOCAL T-MOBILE STORE. 99% OF PROGRAMS, DATA AND PHOTOS WERE TRANSFERED. ONCE COMPLETED TRANSFER, CUSTOMIZING TO MY PERSONAL SETTINGS WAS FAIRLY EASY. PHONE IS VERY COMFORTABLE TO HOLD. MUCH LOUDER THAN MY OLD PHONE. SCREEN MAKES TEXTING EASIER TOO AS LETTERS AND NUMBERS JUST THE RIGHT SIZE FOR MY FINGERS. SCROLLING IE FACEBOOK, YOUTUBE, ECT. IS REAL SMOOTH. PICTURES ARE EXCELLENT IN THE PHOTO ALBUMS. YOU CAN ALSO EDIT PICTURES IN THE ALBUM A HUGHE PLUS. THE THREE CAMERAS ARE EXCELLENT AS WELL AS THE PORTARIT MODE AND THE VIDEO. VIDEO IS SO LIFE LIKE AND THE COLORS ARE FANTASTIC. THE NIGHT VIEW WORKS BEAUTIFULLY AS THE PICTURES COME OUT LIKE THEY WERE SHOT IN DAYLIGHT. I BOUGHT THE IPHONE 12 PRO RENEWED. BATTERY LIFE WAS 96% AND I FOUND NO SCRATCHES, DENTS OR DINGS. IT WAS JUST LIKE A BRAND NEW CAMERA OUT OF THE BOX. IT DID HAVE DIFFERENT CHARGING CABLE AND POWER BLOCK WHICH WERE APPLE CERTIFIED. I HAVE HAD THIS PHONE FOR ABOUT 2 MONTHS NOW AND I LOVE THIS PHONE. THIS IS MY FIRST IPHONE AND THE BATTERY LIFE IS GOOD BUT COULD BE BETTER IF IT HAD A BIGGER BATTERY. I HIGHLY RECOMMEND THIS PHONE AND I DON'T THINK YOU WILL BE DISAPPOINTED.","[{'small_image_url': 'https://m.media-amazon.com/images/I/61U0NFSik1L._SL256_.jpg', 'medium_image_url': 'https://m.media-amazon.com/images/I/61U0NFSik1L._SL800_.jpg', 'large_image_url': 'https://m.media-amazon.com/images/I/61U0NFSik1L._SL1600_.jpg', 'attachment_type': 'IMAGE'}]",B09JF5ZHQS,B09JF5ZHQS,AEZTLCQYQOHEYVSABS7GNAE2IIQQ,1647128522330,21,True
1.0,Don’t all yet continue usage to early for complete results,It is very difficult to set up manually oh no SIM card which was supposed to be included and no charge cord or ear plugs what has happened plus I believe affirm overcharge me and today they are easy to be hacked into account,[],B07759SBP7,B07759SBP7,AETIUTFQAKC56MOIIYUSHDFYPNVA,1662244368281,0,True
5.0,Great value,Exactly as ordered. Great value for the price.,[],B07759SBP7,B07759SBP7,AFMSBT6IPZ5TIDSTKAS6SXMPCV3Q,1658675887985,1,True
5.0,Great phone exactly as advertised.,SO FAR SO GOOD,[],B07759SBP7,B07759SBP7,AGTUVLLH5L54WV4GQMMW3BWC4PLQ,1558850099052,1,True
4.0,The larger screen comes at the price of bulkiness.,Other than the zoom being difficult the phone performs well.  Previous phone was a 5S.  Can not get iPad and phone to communicate.  Both use ios 12+.  The ipad and 5S did communicate.,[],B07B9LFNM9,B07B9LFNM9,AG6N4M6NR56QN2HRK4NURMGTEFXQ,1550523073794,0,True
4.0,My son has had the replacement for a good while now with no issues,"This phone came in as described...I had to send the first one back because it wasnt properly unlocked (why I didn't give 5 stars, because that was a hassle). My son has had the replacement for a good while now with no issues. The replacement has been a great phone!",[],B00NPY1G56,B00NPY1G56,AEEHTGMOG747KZ5TRC43ACWOL3RA,1489154166000,15,True
5.0,Perfect replacement,Replacement for my old phone. Not paying 1200$ for a new one ya know.,[],B07759SBP7,B07759SBP7,AFD3OTC4HZQZLLRXS35DYYXBY3NA,1665891802731,0,True
5.0,Perfect replacement,Replacement for my old phone. Not paying 1200$ for a new one ya know.,[],B07759SBP7,B07759SBP7,AFD3OTC4HZQZLLRXS35DYYXBY3NA,1665891802731,0,True
5.0,"Great phone, camera , mailbox, memory keeper",I love this phone. It’s amazing. It has 8x the memory of my old 6s,[],B07759SBP7,B07759SBP7,AEKA4QJDDVPESF3ALN3ZZ74SK3HA,1620862656340,0,True
5.0,Love it!,"I was skeptical about ordering a phone off of Amazon, but I love this phone! It came in perfect condition, would’ve never guessed it was renewed. I only had one issue with shipment, but it was quickly resolved when I contacted the seller! Would highly recommend.",[],B08TDTFD8B,B08TDTFD8B,AF3JTAUD3SA4CU7FLVSDXRZ57PCA,1659545624419,3,True
5.0,Be patient,I love this phone! Had a bit of trouble getting it switched over from my other phone but that was the fault of the service carrier. I still don’t know why it won’t ring though.,[],B07759SBP7,B07759SBP7,AEMFC3SGUERV5SY4PM3TX7C5YBTQ,1619366220639,0,True
5.0,Function,Great phone,[],B07759SBP7,B07759SBP7,AGYUZG3ANBI5UKGLGVJUGZ7V3LLA,1566572415151,0,True
5.0,Excellent,Excellent,[],B07759SBP7,B07759SBP7,AGVHRDJNX5BWTZWSPW72QN2VORXA,1619404972979,0,True
3.0,Three Stars,Not bad,[],B004YRBM1Q,B004YRBM1Q,AG7QDNLO4KPK6OD277T5YWMCNPTQ,1456635200000,0,True
5.0,Returned because of defect.  Amazon took it back with no question. I am a happy guy.,"I was trying to save some money by getting a used phone.  The phone was in great condition, and looked like new, until I found that the Bluetooth didn't work.  It's a great phone, but I really use the Bluetooth a lot, so there was no question that it had to be returned.  Amazon gave me no hassles, and I am a happy guy.  I finally gave up the idea of a used phone, and just went out and got a new phone.  Yes it was expensive, but it should last a long time.",[],B09JFN8K6T,B09JFN8K6T,AF6KGZVQS3GM2AWN2XUIW57RJUJQ,1652126168019,7,True
5.0,Good phone,"I've had no problems with this refurbished phone. I've been really pleased by the extra long battery life compared to my old iPhone SE. I selected this model for the camera, which is great. The fingerprint recognition works better than my old SE also.",[],B07B9LFNM9,B07B9LFNM9,AGLGFAZV3CHUPC23HU3K54LEF2WA,1561829867131,0,True
5.0,Great phone,"Great battery life, excellent condition",[],B072KFCKYH,B072KFCKYH,AHJOPQG6DUB67IODI6PLPG6VO56A,1554554457190,0,True
5.0,Like new refurbished iPhone 7 from MyWit. Great price.,Worked right out of the box.  Included wall plug with USB to Lightning cable.  Took to Verizon Wireless store to get free sim card and phone activated.  Everything works.,[],B07234GKN5,B07234GKN5,AGYIR2K5TOOAEZKMXZT4AEDSZMRA,1547909773056,2,True
5.0,The phone is great!,So far so good. The storage is the reason why I got the phone. Seems to work better than my old one. Better service and faster load times.,[],B07759SBP7,B07759SBP7,AEF2RQPZGNQG67XWAGMTRRDUH7HA,1649691718447,0,True
2.0,On my 3rd replacement,"First I got a red iPhone 6 (maybe?) when I ordered an iPhone 12 Pro. Some other people have had this same thing happen.<br />The 2nd phone got super hot when charging either regularly or magnetically.<br />I’m on the 3rd phone now and the battery life leaves a bit to be desired. The capacity says 90% but it barely lasts all day. I shouldn’t have to charge my phone during the day, that’s a huge hassle. We’ll see how it goes and if I ultimately return it an get one from someplace else.",[],B09JFP3R1D,B09JFP3R1D,AF23A2OBVRIG6O6KN34SNPB2XNEQ,1657043203422,1,True
5.0,Great phone,Very pleased.  Best phone I’ve gotten,[],B07B9LFNM9,B07B9LFNM9,AHMMOTXFTEQUJUXMY62CH3VNMSGA,1562365097275,0,True
1.0,Possible water damage,"I was excited about the premium renewed phone. I thought Amazon would be better value. Except when I received the phone it kept telling me I couldn't charge due to the port being wet. It was not. It would do this half the time I tried charging, so there's no way I could keep it. I'll just purchase directly from Apple.",[],B09JFN8K6T,B09JFN8K6T,AEI7GHAPVIMEULRVRS4RBJ54BOXA,1675481105401,0,True
5.0,Good phone,Phone works great. Arrived fast. Love how it connected to my iTunes effortlessly. Was priced very reasonably. Had a 3 love my new 4,[],B005XYGFIY,B005XYGFIY,AGGHYNOTWRHHHA5QWHUEPNJWMWQA,1375479143000,1,True
4.0,Aun con batería al 86% es una buena compra,El teléfono vino tal como describe la empresa.<br />El aspecto del teléfono es impecable.<br />El tema es que la batería vino con un rendimiento del 86%.<br />Aun así creo que es una buena compra.,[],B07759SBP7,B07759SBP7,AGE3EXJ5W7AQRLYY3WBSJYOOQEZA,1560908780210,1,True
5.0,Basically brand new for half the price!,"So happy with my purchase. Yes the phone might be refurbished but it works and looks brand new! If you’re thinking about it, DO IT!",[],B08TDT5ZJD,B08TDT5ZJD,AG2MT7HBWFF42CWREUPEAXZTDU2Q,1651726832798,2,True
5.0,It's Almost New,"I never know what to expect when I buy a refurbished phone. This one is almost new. It came with 94% battery health. No scratches, anywhere, even with close inspection. Some refurbished cell phones come with a screen protector already installed, usually to cover up a scratched screen. This came without one because there were no scratches. The only way I could tell it is refurbished is that it came in  a generic box with [as advertised] generic charger and cable. So far, so good it looks and works like new. An excellent refurbished iPhone.",[],B082MTXNT1,B082MTXNT1,AGDBD3MSKALOYXSQNRENP7OYAYTA,1659828363142,7,True
4.0,Good phone terrible packaging,"The phone works fine, but the packaging it came in was not that great. It was just a box with a plastic cover. There was no screen protector so it was scuffed up a bit. It also came in a bag, with zero other cautions. The phone is fine though.",[],B078P38R8L,B078P38R8L,AF4IC6UL3HC4GWYQFSVFXXJQNTGQ,1585428812025,4,True
2.0,Don’t know yet If it’s working capacity is compromised,Arrived very quickly! Very clean!,"[{'small_image_url': 'https://images-na.ssl-images-amazon.com/images/I/71PByDEiXGL._SL256_.jpg', 'medium_image_url': 'https://images-na.ssl-images-amazon.com/images/I/71PByDEiXGL._SL800_.jpg', 'large_image_url': 'https://images-na.ssl-images-amazon.com/images/I/71PByDEiXGL.jpg', 'attachment_type': 'IMAGE'}]",B07759SBP7,B07759SBP7,AEHBIOLJWGXPLSAX5BIKCPPE3BVQ,1590805108362,1,True
1.0,"""Unlocked"" Not True","This phone was former ATT according to Tmobile.  I spent 3 weeks, muultiple sim card replacements, resets, tech calls with amazon, apple, and tmobile -- it would NEVER get signal or only barely.",[],B07759SBP7,B07759SBP7,AFHC45CRMHIMURGNYSVOFVYC5ALQ,1602286363610,0,True
5.0,I love this phone!,I love this phone! I had the smaller 6 and needed the bigger one but couldn't afford to buy it new. I didn't really need the 7 just the bigger screen. Just what I ordered and wanted. No issues. I'm very happy.,[],B00NI0BPTE,B00NI0BPTE,AHLY7254ES3ONJA3JVHGLAGRWILA,1493227904000,1,True
4.0,Check phone prices at providers first,"Charging cord didn’t work and Metro PCs offered a new one at the same price with no contract( I didn’t check before I bought the reconditioned one but should have) otherwise the phone is ok, one small scratch",[],B07759SBP7,B07759SBP7,AE3JXINSGHLQIUBRJXKMPQ6TEE3A,1581397919093,0,True
4.0,Check phone prices at providers first,"Charging cord didn’t work and Metro PCs offered a new one at the same price with no contract( I didn’t check before I bought the reconditioned one but should have) otherwise the phone is ok, one small scratch",[],B07759SBP7,B07759SBP7,AE3JXINSGHLQIUBRJXKMPQ6TEE3A,1581397919093,0,True
5.0,My iPhone is better than I expected and has 100% battery,Very nice iPhone 8plus in perfect condition with 100% battery life.,[],B07759SBP7,B07759SBP7,AGV5GQHQCTXQVJFHPFL2ZWV2ZHGA,1668076022228,1,True
4.0,This phone's appearance looked new. It arrived when it ...,"This phone's appearance looked new. It arrived when it said it would. The only problem is when making or receiving a phone call, it shuts off.",[],B004YRBM1Q,B004YRBM1Q,AF4CMUGIWK3UYORWTD7TBZ5EV4GA,1442654871000,1,True
5.0,I have had this phone for about three weeks and ...,I have had this phone for about three weeks and so far theres no problem to report.  I hope it continues...,[],B00NPY1G56,B00NPY1G56,AH7NMC2T5D6BGKG7LV2AZXROFUNQ,1527536119767,0,True
2.0,Was happy about getting this phone…but ended up disappointed. Updated with 2nd phone.,"Update: I received the second refurbished phone today. There are a few minor scratches on the face, but no big deal. Battery life on this phone is 93%. This phone also has the same issues as the 1st phone I returned. It has low speaker volume and this one also has a lower speaker phone volume than normal. I spent an hour on the phone with Apple support. They were unable to help fix this issue because it was a hardware issue. Needless to say this phone is also being returned. I will not be purchasing a phone from this company again.<br /><br />  I bought this renewed phone which stated excellent condition. There were scratches on the screen, with one deep scratch on the bottom left. Which was really no big deal as it didn’t interfere with the phone. On excellent condition phones, it states battery life at 80% or above. This phone had 77% battery life. It has low phone volume. When making a call it’s extremely hard to hear who your talking to with the ear speaker. The only way I was able to talk to people was using the speaker phone. This is the reason I’m sending it back. I will give them one more try and reorder another phone. 🤞",[],B07759SBP7,B07759SBP7,AG6MY6AQF3KDYDDVRKVZYF7JORGQ,1668540222154,0,True
5.0,Good price,Very good price for refurbished apple iPhone 7,[],B07234GKN5,B07234GKN5,AG7TAVB5QVFXUOCV4JEB6IVRC6HA,1624539278845,0,True
5.0,The phone is performing as promised!,The verdic is still out on the overall performance and quality of this re-newed iPhone 7. The only minor issue I have is the battery life.  I’m curious about the first 30-90 days.  But if the phones continues to perform as I initially purchased then I would give the process from purchasing to use 5 stars!,[],B07234GKN5,B07234GKN5,AH7IIDZNDGMSQH7VYL5BNTGUSIUQ,1575662372214,0,True
1.0,Bad battery’s,Worn out battery,[],B07759SBP7,B07759SBP7,AGTJFKNNSVUUZT3OR3UO2VF7EI2Q,1645236569972,0,True
5.0,Five Stars,Good,[],B004YRBM1Q,B004YRBM1Q,AFL35GED6563ZJSA6FNZIR2DAV3A,1447502316000,0,True
5.0,Five Stars,Excelente y sin ningún daño .,[],B00NPY1G56,B00NPY1G56,AHPLYXSIJVGMVBIAHHWEJZQCEKSA,1530346439763,0,True
2.0,Two Stars,your cellphone works only 30 days,[],B004YRBM1Q,B004YRBM1Q,AE3O2MLMSG3ODZRWOVRKZNIRH3VA,1444920549000,0,True
1.0,Desastre,No le funcionaban las camaras,[],B078P38R8L,B078P38R8L,AHMD3DVPNEEGIFN6R2D55AI234TQ,1627168433530,0,True
5.0,Everithing ok.,Excelent phone!,[],B07759SBP7,B07759SBP7,AEQIJRRVPOU7ODN2M2LW52WEJPDA,1564740351368,0,True
5.0,"Good phone, lots of memory",Much better than my erratic 6S,[],B07759SBP7,B07759SBP7,AG466JBGSACJ24L5YLWB4ONZHV4Q,1583458566293,0,True
5.0,Five Stars,nice,[],B00NI0BPTE,B00NI0BPTE,AGSIUCCWIXJLJFI3DCQ2BUHEAL7Q,1487865539000,0,True
1.0,You said unlocked that why i did order,Because it’s locked<br />Can’t do anything,[],B07B9LFNM9,B07B9LFNM9,AH7L5AHIFGCEKCNFTZXEMGOSCCRA,1561446912669,1,True
5.0,"Good people, fast and accurate!","Great phone, good price",[],B07759SBP7,B07759SBP7,AE36DY24WJMWQMMBESSHOPLO5J7A,1603513366493,0,True
1.0,Screen was heavily scratched upon receiving,The phone was never powered ON so can not comment on functionality since the scratches on the screen were so numerous that phone was immediately reboxed amd returned.,[],B09JFC967X,B09JFC967X,AGXBOLM3QZ56D24EPCP5MHIACKMQ,1672928656972,3,True
5.0,Good used phone,As expected good usedphone 89% battery life; good reliable seller.,[],B07234GKN5,B07234GKN5,AGZAQF7QSQRLYRXYBX5IJAYTZPMQ,1577194722035,0,True
5.0,Great value for the price,"Excellent camera quality, beautiful color, great value for this price tag. Minimal scratches on the screen (almost invisible). I recommend it!",[],B07CQNF813,B07CQNF813,AEWIMSRBNJA3HQH6EFG53KSMPJGA,1576557986353,2,True
5.0,Awesome phone,"I was nervous buying a phone online, I have been burnt before, but the purchase was better than advertised. Came in perfect condition .  Works wonderfully and I now have the person whom I will buy all future phones",[],B07B9LFNM9,B07B9LFNM9,AHTLRN3UAWHD3WTWLDRRSVQJJSMQ,1559602326800,0,True
1.0,mi cel esta raro,"se traba cuando pongo las cámaras me vino con la pantalla picada de algún golpe fuerte y sospecho que la parte metálica fue reemplazada para que aparezca nuevo, me vino batería 96% estaba contento pero yo uso mas el modo video y la cámara, no se tiene algo como que se traba no enfoca bien siento que le pasó  algo grave por eso lo devolvieron a apple NUNCA MAS COMPRO CELULAR RENOVADO NI PRIME NI NADA...",[],B09JFP3R1D,B09JFP3R1D,AG4MDL4PE7ZZL3BHVC47RZFDGNLA,1663730268694,4,True
4.0,Go for the IPhoneX,Several things have never worked right. I liked the 6 plus better,[],B07759SBP7,B07759SBP7,AFSEHPTDUOO7BSHVS6NEQ7MEEG5Q,1579993986539,0,True
5.0,Very good,Bought it for a gift 🎁 and they had no issues and are enjoying it. Like brand new I give it a 5 ⭐️,"[{'small_image_url': 'https://m.media-amazon.com/images/I/71OpVXkeUKL._SL256_.jpg', 'medium_image_url': 'https://m.media-amazon.com/images/I/71OpVXkeUKL._SL800_.jpg', 'large_image_url': 'https://m.media-amazon.com/images/I/71OpVXkeUKL._SL1600_.jpg', 'attachment_type': 'IMAGE'}, {'small_image_url': 'https://m.media-amazon.com/images/I/71TIjr1v9mL._SL256_.jpg', 'medium_image_url': 'https://m.media-amazon.com/images/I/71TIjr1v9mL._SL800_.jpg', 'large_image_url': 'https://m.media-amazon.com/images/I/71TIjr1v9mL._SL1600_.jpg', 'attachment_type': 'IMAGE'}]",B09JFN8K6T,B09JFN8K6T,AFFNLRUAVOL3ND3PSGWZWEJMKICQ,1681829217864,0,True
5.0,Great purchase,Bought it for my kids Xmas. No complaints so far! I’ll buy again,[],B07B9LFNM9,B07B9LFNM9,AEUPBY6TN4XRL47OGOKOIDVRUEWQ,1581540851867,0,True
4.0,Great purchase,Very pleased with this phone. Excellent condition. I will purchase again if the right equipment is available.,[],B07B9LFNM9,B07B9LFNM9,AE2CBPWL5RT2THYJI5LOJNEOMSLA,1562201069534,0,True
3.0,Worked great for 11 months.,"My wife and I both had old iPhone 6s, until they finally broke down, from being dropped too many times.  So, last year I thought we'd try these refurbished iPhone 8’s from Amazon.  Mine worked fine at first; however, hers had issues within the 90-day warranty period, so we sent it back and got a replacement.  Both phones have worked great for the past 11 months, until two days ago, when my phone’s audio stopped working on phone calls.  However, the speaker still works, so it still works with phone calls, unless you want to have a private conversation, or use your Bluetooth.  Now, I have to decide whether to try to have it repaired, or try to buy another refurbished iPhone 8.  We want to keep the same models, because then, all of our chargers at home and in our cars, are interchangeable.",[],B078P38R8L,B078P38R8L,AHJ4JKBHMLYPXGFGHAKMUKUMVQ5A,1669256037301,2,True
5.0,Good,Good product,[],B09JF5ZHQS,B09JF5ZHQS,AE3TLFHOMNQ3X7CGZ7BU4TAQA4NA,1659160529959,1,True
5.0,Great phone.. great price,I bought this phone for my daughter and she loves it!,[],B07759SBP7,B07759SBP7,AH4J3I6KUJESHDW2IGWPSV6UTNWQ,1583766752706,0,True
1.0,Port won’t hold cable after 5 months: poor quality!,"I started having problems with the port not able to hold on to the cable for charging nor will it charge on its back! Purchase it in Feb 23,2021 and already by August 2021 it broke down!  Can I have this replaced",[],B07759SBP7,B07759SBP7,AFJCUJ6UEJ563ACQLNYWV52G3IFQ,1630727406600,0,True
5.0,Every one needs one,Quality,"[{'small_image_url': 'https://images-na.ssl-images-amazon.com/images/I/71FH+cyJVDL._SL256_.jpg', 'medium_image_url': 'https://images-na.ssl-images-amazon.com/images/I/71FH+cyJVDL._SL800_.jpg', 'large_image_url': 'https://images-na.ssl-images-amazon.com/images/I/71FH+cyJVDL.jpg', 'attachment_type': 'IMAGE'}]",B07B9LFNM9,B07B9LFNM9,AFFKF5QJLKWTD353EN5DPNCGQ5JQ,1546697954839,26,True
5.0,Surprised me,"Excelent besides a few micro scratches on screen, other than that I would think is brand new",[],B09JFJ1Q5C,B09JFJ1Q5C,AEHRLOJEEHRONTIJHU3KINVDAMIQ,1674274259274,0,True
5.0,Good product,"This is the 3rd refurb iPhone 8 plus I purchased. The other seller I used provided ones with mic issues. This phone from this seller is impeccable. Very clean, flawless and everything works. Arrived when expected.",[],B07759SBP7,B07759SBP7,AELS5HEXEYGT366CAMPSZGFHYORA,1580862868367,1,True
1.0,NOT UNLOCKED. BUYER BEWARE.,This phone was listed as unlocked and it wasn't. It could not be connected at all. Buyer beware.,[],B07759SBP7,B07759SBP7,AFVLSXUKQPKE7UFHG4BTDTAU6LCQ,1589293583311,2,True
1.0,Lock button not working,"I was abroad US and I was not able to return the item, I ended up in paying additional 80.00 for repair and replace of the part",[],B07759SBP7,B07759SBP7,AGPV3ZVLHSP3UX2MXGJMNKA7K22A,1574826723167,1,True
3.0,very short battery life - 1 hour,the phone works well in all aspects but the battery does not hold a charge and within an hour is depleted.  Unacceptable,[],B078P38R8L,B078P38R8L,AH7TVCJ672SUIKDRTSMSY3OPJYWA,1610059815243,1,True
5.0,I phone 12 Pro 512 GB,So far very good performances,[],B09JFC8JGG,B09JFC8JGG,AETEWOHS3FPBCUB2YL4R3BOEENAA,1679117941231,1,True
5.0,I phone 12 Pro 512 GB,So far very good performances,[],B09JFC8JGG,B09JFC8JGG,AETEWOHS3FPBCUB2YL4R3BOEENAA,1679117941231,1,True
5.0,iphone 8 PLUS,"phones in great condition, works great, They both look new!",[],B07759SBP7,B07759SBP7,AEWPYMC5M6RWWGN5HR35LQCHPIWQ,1581421859717,0,True
3.0,Muy caro,El teléfono está muy caro y no está muy bueno me costo mucho la actualización!,[],B078P38R8L,B078P38R8L,AHUFC2VKXA24NJJXAE5KWBC5VB5Q,1654621445453,0,True
5.0,Awesome phone,So nice. Just as expected,[],B07759SBP7,B07759SBP7,AGGM7IQYRHFLJMP3NTAQ6KUUGXLQ,1563679071364,0,True
5.0,Excellent,Amazing product & fast shipping ❤️❤️,[],B07759SBP7,B07759SBP7,AHH6S3T7LJ4OWNZXD5CVWRFY3TVA,1543898837551,0,True
5.0,Perfect,Perfect,[],B07759SBP7,B07759SBP7,AHR2G3W3ZYB5R35AAMURL2OP4QTA,1542942226572,1,True
3.0,But worth the money,Took to long to get,[],B07759SBP7,B07759SBP7,AHDPWY2GII46EVVEQEJODYD3XJKA,1560762037779,0,True
5.0,Great Iphone,Perfect!,[],B07B9LFNM9,B07B9LFNM9,AETZSJCMLC4PHSYW62C3CPPVHOYA,1563373009468,0,True
5.0,Looks brand new,"Battery great , looks brand new. No problems what so ever ! Reviews threw me a little off but we got it from buyspry and it perfect, ordered my husband one also and his is perfect also.",[],B07759SBP7,B07759SBP7,AFR4AO37WYLNW4L5L5SPI424UWTA,1553192147907,2,True
5.0,Shipping,I loved it. Awesome,[],B07759SBP7,B07759SBP7,AHG623Y56RPTQ5WQILWEXWD2YHFA,1619732494431,0,True
5.0,Works great!,iPhone 8 works great as if a new phone. Battery life lasts all day long!,[],B078P38R8L,B078P38R8L,AFZYGYZLVFXSQOQH37SCKGY4KQKQ,1634948274123,1,True
4.0,"Slight signs of wear, no complaints.","Bought ‘refurbished’ or ‘renewed’.<br />Has some light scuffing on the screen, and looks like it may have been serviced (pry marks around the frame). But I’ve complaints. At a fraction of the cost of a new one, there's no reason not to get one.",[],B07759SBP7,B07759SBP7,AGCJ6WFOEGGOTPYJQOOD3ZYMKZ4A,1578265468257,0,True
4.0,Phone is very nice.Delivery was right on time. Don’t know about battery life yet.,Ordering this phone was so easy! Delivery was just as projected. Phone is very cool.,[],B07759SBP7,B07759SBP7,AGWNY5XZZU5R4JUOEXOYCJLEJUVA,1644801939567,0,True
5.0,Glad I picked the plus,"I wasn’t sure about the plus, but it’s actually kinda nice to have. Anyway phone works great and after a couple days I really grew to love the bigger screen. I upgraded from an iPhone 5 so it’s a big shift. But really a good phone so far. Battery could be better but the camera is 1000% that the previous iPhones. Tho not as good as galaxy. But worth it if you want iMessage and other iPhone features.",[],B07759SBP7,B07759SBP7,AHQNCDTXLCBLNI2RGUEADIWMKY3Q,1580325888013,0,True
5.0,Great value and works like new.,This phone was an excellent value and works like a new one.,[],B07759SBP7,B07759SBP7,AHETGPNV5JLSQRNU3EVIURRI2NZA,1627963057990,1,True
1.0,Face ID and camera were not working,"I bought this phone because it was sold directly by Amazon, an it was advertised as ""Renewed Premium"" and ""A like-new experience"". It turned out that Face ID was not working and the camera took blurry pictures (see attachments). I returned it an it took them almost a month to refund the money back.","[{'small_image_url': 'https://m.media-amazon.com/images/I/51E-YjPK8EL._SL256_.jpg', 'medium_image_url': 'https://m.media-amazon.com/images/I/51E-YjPK8EL._SL800_.jpg', 'large_image_url': 'https://m.media-amazon.com/images/I/51E-YjPK8EL._SL1600_.jpg', 'attachment_type': 'IMAGE'}, {'small_image_url': 'https://m.media-amazon.com/images/I/51UpcOzJg9L._SL256_.jpg', 'medium_image_url': 'https://m.media-amazon.com/images/I/51UpcOzJg9L._SL800_.jpg', 'large_image_url': 'https://m.media-amazon.com/images/I/51UpcOzJg9L._SL1600_.jpg', 'attachment_type': 'IMAGE'}, {'small_image_url': 'https://m.media-amazon.com/images/I/51oXZQhs5CL._SL256_.jpg', 'medium_image_url': 'https://m.media-amazon.com/images/I/51oXZQhs5CL._SL800_.jpg', 'large_image_url': 'https://m.media-amazon.com/images/I/51oXZQhs5CL._SL1600_.jpg', 'attachment_type': 'IMAGE'}, {'small_image_url': 'https://m.media-amazon.com/images/I/51wQPr8DeBL._SL256_.jpg', 'medium_image_url': 'https://m.media-amazon.com/images/I/51wQPr8DeBL._SL800_.jpg', 'large_image_url': 'https://m.media-amazon.com/images/I/51wQPr8DeBL._SL1600_.jpg', 'attachment_type': 'IMAGE'}]",B09JFN8K6T,B09JFN8K6T,AG6OLJPJ6MFV75LU7RRP4VXABWYA,1674435656192,1,True
5.0,Delivered right on time,I've carried it to Africa for a friend. We'll see how it functions for him.,[],B07759SBP7,B07759SBP7,AH254G7R7HXFFISGEBVESAY3LCFA,1603711322141,0,True
