rating,title,text,images,asin,parent_asin,user_id,timestamp,helpful_vote,verified_purchase
1.0,Ear speaker did not work! Great customer service!!,"The seller was great with the return process and excellent customer service, but the phone was poor quality. The ear piece speaker did not work. The screen was scratched.",[],B078P38R8L,B078P38R8L,AFJCXBHLP5JXM6NS2RWUVVR4RQRA,1667098482878,0,True
1.0,"8Plus, Screen had black zone in center, Battery overheating","I read the reviews and ordered an Amazon renewed iPhone 8Plus.  Product shipped on schedule and I was optimistic when I opened the package.  Other that VERY light scratches on the screen, it looked brand new in a non-Apple box.  HOWEVER, when turned on, we immediately noticed a black 0.5"" dark spot in the middle of the screen.  After charging, the phone became EXTREMELY hot and we had to shut down.",[],B07759SBP7,B07759SBP7,AH3M5VTQOLFOSZOKUO3KSF62BX6Q,1564002486085,0,True
5.0,Amazon refurbished phone work really well,Works well for a use phone,[],B07759SBP7,B07759SBP7,AF5ESOA7OHJP24H7SVXGP64G3ZSQ,1578939630923,0,True
5.0,Excellent Phone from Amazon,A great renewed phone from Amazon! I had purchased a phone on here before and now I returned for a much needed upgrade. Had the phone arrive with 95% battery and no scratched or blemishes.,[],B09JFP3R1D,B09JFP3R1D,AHK6347E3WI4A2F7UFU37YKTSDRA,1638597000920,18,True
5.0,Lo que buscaba,"El celular esta desbloqueado y en excelente estado, estoy satisfecha con la compra.",[],B07759SBP7,B07759SBP7,AF64PHAA65ZDE2U3Y5TADLDZILKA,1657858802751,0,True
5.0,Gray iPhone 8 Plus 64gb,"My iPhone 8 Plus was delivered 1 day late but they notified me that it would b late about 1 hour after I ordered it and considering it was only a few weeks before Christmas that was to be expected, I had no problem with that. When the phone came it was perfect and still is other than The speaker isn’t as loud as it’s supposed to be but I don’t use the speaker feature often so that alone isn’t enough for a complaint from me.",[],B07B9LFNM9,B07B9LFNM9,AFX5BDOBJHSOHVJSHHLZS6XARGFQ,1547442521369,20,True
2.0,Not very impressed,I bought this phone for my daughter. She lives overseas. When she got it and transfer the information to this phone it stuck and it happen a few more tome after. I am not very happy and I am trying to see if I can bring it back and change it.,[],B07234GKN5,B07234GKN5,AFZH6DDKHGWEP2CZSP6CWRWALJYQ,1565915824308,0,True
4.0,Iphone 12 pro,Nice product.,[],B09JFC967X,B09JFC967X,AHU4KR2MVYEC6K3W7ARQ23IXMWBA,1671112524294,2,True
5.0,Buen producto,Buen producto,[],B078P38R8L,B078P38R8L,AHSNK54UICJ4XBUVBZOQUZORTFUQ,1676505212889,0,True
1.0,The phone came stolen!!!,"I got the phone and was excited to use it upon arrival. It seemed fine but then when I brought it to T-Mobile to get it service they couldn’t because they said the previous owner reported it stolen!!! Super disappointed and returned the phone to Amazon, hopefully I get my money back.",[],B09JF5ZHQS,B09JF5ZHQS,AHFGB4RP7RSJ4IKIIDETSB33RZCA,1654816236454,4,True
4.0,Love the phone however not sure I got what I paid for,The phone arrived before expected and was in great condition. The battery health is at 100%. A couple issues: I paid for the Amazon Renewed Premium but the box they arrived said Amazon renewed only. I know renewed premium has a different box as my daughter also but a renewed premium phone and her box said so. The premium cost more so it appears I may not have received the premium. Also the “new” charger that was included does not work.,[],B09JFC8JGG,B09JFC8JGG,AEB7RGFJS36PXMIQVWXTOTUGFMDQ,1672629189584,10,True
5.0,The last of the home button and Touch ID iPhones!,"This is my first iPhone, well, actually my second.  I tried the iPhone X when it released but I returned it because I couldn't get used to not having a home button and Face ID.  So I returned it and went with this, and I never looked back.  I love the iOS ecosystem.","[{'small_image_url': 'https://images-na.ssl-images-amazon.com/images/I/61AVz+2t1DL._SL256_.jpg', 'medium_image_url': 'https://images-na.ssl-images-amazon.com/images/I/61AVz+2t1DL._SL800_.jpg', 'large_image_url': 'https://images-na.ssl-images-amazon.com/images/I/61AVz+2t1DL.jpg', 'attachment_type': 'IMAGE'}]",B07B9LFNM9,B07B9LFNM9,AGLRDVIUKVPMABKQNCKH63LV5HEQ,1548202967335,21,False
1.0,Phone didn’t contact to any phone wireless company,"Phone was locked, and was unable to connect to any carrier.",[],B07B9LFNM9,B07B9LFNM9,AGVKYT4GRIAXJE6NL2YO4G5GN7LA,1560901238321,3,True
5.0,Good buy,I’m<br />Using this phone right now and it’s still in the same condition as when I bought it maybe 2 years ago,[],B07234GKN5,B07234GKN5,AHLTLXMHICD7EWF3VMVKADKWNHCA,1660061424816,0,True
5.0,Looks good as New,It shipped quickly and came with a charger and cable.  It looks like New.  The battery is at 93%.  I did end up buying the Apple fast charger and a usb c to lightning cable.,[],B09JFS4P67,B09JFS4P67,AF5Y3GT73OGOA7C3PLBIJHTRKHZQ,1652658258111,1,True
5.0,Came like new!,"After reading a lot of bad reviews, still ordered this phone. Phone arrived on time and well packaged. Upon opening I was surprised. Phone was in excellent condition with no visible scratches or dents anywhere. Looked absolutely brand new. Came with charger and everything. Battery health was a healthy 96%. Overall satisfied with price",[],B07759SBP7,B07759SBP7,AF525RSBYIJRG27L37ESIFLO5YHQ,1662905748049,3,True
1.0,Waste of money,"I needed the phone ASAP because of an emergency. The phone came and was not the right phone. I ordered a space grey iPhone 256 gsm unlocked but when the phone arrived it had the label and description of the iPhone white 256 gb AT&T. I was confused at first but then once I opened it, it was space Grey but did not function. It constantly led me into the screen saying I needed to connect it to iTunes. I did that and still nothing. The phone eventually didn’t power on at all even while being connected. I was beyond disappointed, eventually I even realized that the screen on the phone was not even An original Apple screen.",[],B07759SBP7,B07759SBP7,AFRV33SBOUKR2VCAJGMH3SGG4ISQ,1603767077119,1,True
1.0,Know your seller’s previous plan,"“Renewed” is very misleading as the phone I received had a pre payed plan already in place inhibiting a new service being placed.  After talking to 3 specialists, I discovered that even if I waited for the plan to expire, I would be unable to use it for my regular plan without starting a new pre pay plan of my own for at least 6 months.",[],B07B9LFNM9,B07B9LFNM9,AEPYJUT5QXZQOD5OVSQOC32ASNNQ,1619460878150,0,True
5.0,Great value for low needs user.,Bought for my 87 year old mom. Now we text every day.,[],B07759SBP7,B07759SBP7,AFNQ7GM6AK7ML6DF7UGTX24KE5BA,1659234174756,1,True
3.0,Battery only 89% Customer Service states 30 days for refund after return!!,"Phone was in great shape, no visible damage, powered up with my SIM card easy peasy. However, battery was only 89%, not 90% as promised. I returned phone in a couple days. Phone was delivered to the amazon dock on Monday and today is Friday. Customer service just told me phone is still on the dock and I'll get my refund ""by"" May 21, 2023, which is 30 days from today, 34 days from when they received it.",[],B09JFN8K6T,B09JFN8K6T,AE7362ZQPZWM4GQKGIZJ5WAVDL7Q,1682120702821,2,True
5.0,It came in immaculate condition,I ordered the 12 Pro renewed premium. It came in perfect condition. No dings no scratches. Battery health at 92%. I’m very happy with it.,[],B09JFC8JGG,B09JFC8JGG,AGB7J6I3T4GXURABKECCQZCW6RPA,1683312104737,0,True
4.0,Above my expectations,"The phone came looking almost like new. The box was an original iPhone box; it’s was quite “beat up”, but I don’t keep the boxes anyway. Phone started up like brand new and I follow the IPhone set up get me going. At this point I would definitely buy another one. The battery capacity was 99%, well above the minimum 75% they guarantee.",[],B079H6CWYH,B079H6CWYH,AF6SKVIV3JU3ZUSOTBF4ISFQ2ZDQ,1563098055518,1,True
1.0,Unsatisfactory,"Horrible and unsatisfied. It was a Japanese model and worked for a short time and then went into no service. And now I invested a good chunk of money (for us it was a lot) trying to be responsible and just upgrade a little, and am left with a phone that won’t do anything.",[],B07234GKN5,B07234GKN5,AF3AW4JSNHCLXD56BHYZERBAGE6A,1605925204264,3,True
5.0,VERY pleased with this purchase,"Received my iPhone 12 Pro, in practically BRAND new condition. No scratches anywhere on the device, packed neatly, accessories included, and even with 100% battery health, to top things off! Could not be more pleased with my experience, and am very much enjoying this phone so far. Would highly recommend",[],B09JFN8K6T,B09JFN8K6T,AFDBWTNOP6LOJJP5VDJXZQ4XP7UA,1667793806493,6,True
5.0,"Muy bueno,gracias",Todo bien,[],B07759SBP7,B07759SBP7,AHDFDB3KPT7PC2IPBAK6WW3TYD5Q,1658087981796,0,True
5.0,"WOW, I got my iPhone 8+ Early!!!",What a nice surprise! Item arrived early and was packaged very well. The iPhone 8+ looked new even without the original packaging. It came with a charger and charging cable. All iPhone functions were working. I'm so delighted with this product. Will not hesitate to place another order from this merchant. Thank you.,[],B07759SBP7,B07759SBP7,AEDIAE7KMGNVJGEUTCBEPLTVDDIQ,1615514775457,0,True
3.0,Three Stars,"camera lens was broken, otherwise phone in working order",[],B00NQHZ2RU,B00NQHZ2RU,AFT2QBIJGYO5Q6MLTAUR4NXXY6AQ,1520450776436,0,True
5.0,St. Lucia  HELLO,II would like to buy this phone from this company the iPhone 8+ but I don't know if it is on lock I am scared that I'd buy it and it would not work in the Caribbean it says GSM but I am still scared if it is lock.,[],B07759SBP7,B07759SBP7,AHZF3PUSZNX325FYYILCHXC3DZIA,1558808295839,2,True
5.0,Product worked as advertised. 🙌,"I bought this cell phone even after reading some negative reviews. I thought the good reviews outnumbered the bad ones. This iPhone 8plus has worked amazingly so far. I’ve only had the phone about two months. So far I’ve had no problems, everything has worked great and the phone was in great shape! Thank you!🙌",[],B07759SBP7,B07759SBP7,AFQVG32BX5GRXRG3VQAYLOBXL3KQ,1649545104126,0,True
5.0,Love it,No scratches. Easy to set up. Has good battery life so far,[],B07759SBP7,B07759SBP7,AHC72HWYY7CALHTMB4QXHIIIG3XA,1564672452211,0,True
1.0,Catastrophic battery failure from the start.,Didn’t work more than a week. Waste of time and money. Don’t buy from this seller. Scam.,[],B081MCRQG3,B081MCRQG3,AFMJDLM37WO2L5356UVOVPUDHVCQ,1643570836838,1,True
1.0,Did not work,Had to return it,[],B07759SBP7,B07759SBP7,AF4JA4GCGPH2UHHNXITZIRSJNK6Q,1578841589477,1,True
5.0,Mesmerizing,Excellent,[],B00NQHZ2RU,B00NQHZ2RU,AGTBSI7X45HWIP2PKKHFLP74HSAA,1475257592000,0,True
5.0,IPhone 8 Plus Refurbished Review,Phone has worked good so far.,[],B07759SBP7,B07759SBP7,AERS7HROPDZOQTIZRNNNKZZLEQSQ,1613674154682,0,True
1.0,Not compatible with every carrier,FYI it may say unlock but it does NOT work for all wireless carrier. (Sprint),[],B07759SBP7,B07759SBP7,AF7LSDWSKQMJQWN7W7YNXBDGAXPA,1563503197314,1,True
5.0,it fits the phone very well.,"Just the one I ordered, very nice.",[],B081MCRQG3,B081MCRQG3,AHH2OZAVU4YY6KXES2V35I33ZQZA,1640889445354,0,True
2.0,Not unblocked,The description of the phone said that the phones are unblocked but they are not.,[],B07759SBP7,B07759SBP7,AFL6YXR4VC4UEHBKKG35KSIGYKYQ,1644626794227,0,True
2.0,Connection issues,I like the phone but it has serious connection issues.  I have only had it maybe one or two months.,[],B07759SBP7,B07759SBP7,AFWPQR2IY5MTIM5JHTVRVH7CTCHQ,1619750492036,0,True
5.0,Like new,It works perfect like new very pleased,[],B078P38R8L,B078P38R8L,AG5CTFL63IXGLX6KM3VOLM6IIS2A,1647670985385,3,True
3.0,Battery health in the 80s,Battery health in the 80s,[],B09JFN8K6T,B09JFN8K6T,AHI5UI5Y3ZRKBCPNYKTRAKC3LV4Q,1684157827917,0,True
5.0,Renewed - and good as new,"Cosmetically, this renewed iPhone looks as good as new, and the battery status is well within the specified range, so nothing to complain about. I purchased it without a sim card as I'm actually using it as (effectively) an iPod touch - but with the added benefit of GPS, with works on an iPhone without a cellular connection. I was happy to find a model with large capacity (256 GB) at a reasonable price (considerably less than an actual iPod touch with the same storage, and that would lack GPS). This model is great for storing/streaming music and tracking outdoor activities. Highly recommended.",[],B078P38R8L,B078P38R8L,AGGMBZG5STXVNRG7VGVBY67TZL6Q,1681696435171,1,True
5.0,No cosmetic flaws and so far works great!,"Phone was received in perfect condition. The phone holds a battery charge and hasn’t given me any problems. I did choose same day delivery and it didn’t arrive when it said it was going to, it was delivered overnight and left on my step.",[],B09JFN8K6T,B09JFN8K6T,AGY2JCCBZQO55NQPTD2O3RU6Q27A,1673056379281,1,True
5.0,Love love love,"This is my first time buying a phone like this, I was a little worried at first. But everything turned out great! The phone came in excellent condition, and pretty fast. The color is to die for  and the battery life is amazing.",[],B0B5FLX9WS,B0B5FLX9WS,AHXXCTXAOCWBN7CIWR2QTG33AK3Q,1665189649734,5,True
4.0,"Overall, good purchase.","I bought it a year ago and the speaker didn't work very well, I couldn't hear people talking when they called me or I called them. Thankfully it was still covered under apple care so I got a brand new one.",[],B00NQGOZCY,B00NQGOZCY,AHIQ2T5X4MSCLHTHYEC22YDIDZLA,1465826035000,1,True
5.0,Great Condition and Great Value,"I just got my iPhone 12 Pro yesterday and so far I've been very pleased. It was in very good condition, any minor imperfections will be hidden by a case and screen protector.",[],B09JFC8JGG,B09JFC8JGG,AE5UPWUS3MQKY46YCUDFEAVL5KFA,1649874837173,4,True
5.0,Five Stars,Perfect God bless you,[],B00NQHZ2RU,B00NQHZ2RU,AE7RY2JUIGLDPHA47UYPFGP6F7XQ,1465230442000,0,True
5.0,Works great,Got it shipped in a certified refurbished Verizon bag. Works great so far.,[],B07B9LFNM9,B07B9LFNM9,AG74E6GYVCMTYAFGAWLASYKO65BA,1555000586071,6,True
3.0,"Looked and worked great, but battery was draining fast","The phone looked practically new, and the setup/performance was great, but I noticed the battery was draining a little faster than I’d expect.  I fully charged it overnight and after a couple hours of very light use (checking email/weather and a few minutes of video streaming), the battery was already at 78%.  I know it’s a refurbished phone, but for the price I expected the battery life to be better.  Returned and opted to buy a new phone directly from Apple.",[],B09JFP3R1D,B09JFP3R1D,AFJOHDGDNPE4YLDEKW4Y3ZL3XCHA,1681341980953,0,True
1.0,Don’t waste your money,"The phone arrived on time, the battery works pretty well, but after almost 3 months  of using it, it stoped working correctly, I’m having trouble connecting my phone to my phone services. After a 2 months of the purchase my phone turns off for no reason even though the battery is full. I don’t know what to do please don’t buy this phone I know is $350 it seems to be good price for an iPhone 8 but don’t waste your money on it",[],B07759SBP7,B07759SBP7,AFUOGK7GT4ZCC5JNCODBFQGGRQ6Q,1591317851551,0,True
5.0,Honest seller,I am very happy with my Apple IPhone 8 Plus.<br />It came as promised with all features that I wanted and works perfectly with my service.<br />I have referred my friends to the seller.<br />Thank you ...,[],B07B9LFNM9,B07B9LFNM9,AFRMC525GA5XF4W3JCPSNUVGOKTA,1562631091327,0,True
1.0,Poor screen,"The screen is randomly working. Obviously it's been replaced with a 3rd party part, and they didn't check the quality of it.<br />Purchase at your own (very high) risk.",[],B07759SBP7,B07759SBP7,AEYYJD4SIS3IELIMZDTRVWRAWPIQ,1576700689714,2,True
5.0,Apprehensive at first—but Truly Beyond Satisfied!! Excellent product!,"I was apprehensive about getting by a refurbished phone...this was my big switch from Android to IPhone! There is not A single complaint! The phone was excellent condition, battery works great! I am very pleased!!",[],B07B9LWLR7,B07B9LWLR7,AE5ROM72LO3PDPVDANLUKAOWM2RQ,1581816403201,0,True
4.0,Works as expected,Works as expected. Clean and scratch free. Battery health was about 90%,[],B07759SBP7,B07759SBP7,AF7CVQE66O7P5MDSPESPFHDOXMYQ,1566614627008,0,True
5.0,Works perfectly,Works perfectly,[],B07759SBP7,B07759SBP7,AEGU6LKUVNAJZ2BGCPSRCBTRTLJQ,1548520008798,0,True
5.0,Looks brand new,[[VIDEOID:4649cb8ca6da30900b331ef687109d81]] The phone is in great condition. No scratches and came with a charger. I’m very satisfied! Will likely buy another for my daughter.,[],B07759SBP7,B07759SBP7,AHMHZKGK7DC7AMQCQPL3SHVZVVIQ,1616111192251,1,True
5.0,Like new,Apple phone came timely and appears just as advertised. Looks like a brand new phone. I am pleased with my purchase.,[],B00NGOCER4,B00NGOCER4,AHMUD446Q3IFAICMOVZOMP5YCWVA,1548994105297,0,True
4.0,Why the battery will not charge?,The battery will not  charge?  I have not used this phone that much.,[],B07759SBP7,B07759SBP7,AFTZUQ6D2B4USNFC5KT73HL6TJ2A,1581472417121,0,True
5.0,Great service and warranty and products thank you.,They made the purchase very smooth which I liked the fact that if I was not happy anything they would either fix it if needed or let me return it. With Apple behind on new phones the timing was perfect. They built me a 256gb phone that I can use for lots of photos in my business it really is just like a new phone and a computer combined thank you for giving me great service And product. I would not hesitate buying from this dealer. 5 stars done right.,[],B07759SBP7,B07759SBP7,AEY7DOGABNFWVZ5YIWAWVBWOT54Q,1589483020075,1,True
5.0,Great Decision,Phone came in great condition. It was a breeze putting it onto the Sprint network.,[],B07234GKN5,B07234GKN5,AGM56PJPKPEV7PMTARPQNF6U3OFA,1547844532487,6,True
5.0,Quick secure shipping,Clean phone in great shape,[],B07B9LFNM9,B07B9LFNM9,AED3XHCPJW7XTCD3OHA4MRUTR32Q,1577643922637,0,True
1.0,Faulty logic board - Apple won't stand behind it,"I bought this iPhone 8 plus in November 2017. In April 2019 it would not power on. After several relies it finally hard reset. It, again, would not power on on September 14 and this time it was dead. Research shows that a ""small percentage"" of iPhone 8 manufactured between September 2017 and March 2018 had a faulty logic board. This is apparently one of them. The kicker is that Apple will not stand behind this and is charging me $455 to replace a defective phone. It's 21 months old and they won't back it. I'd keep this in mind when buying this model. When it worked, it was a great phone with a lot of features, a good camera and plenty of storage. Unfortunately most people can't replace a $900 phone every 21 months nor should they when its a factory defect.",[],B07759SBP7,B07759SBP7,AEY3RWVDZWWM6IRX64EYBXG4OCUA,1568646054341,4,False
5.0,Like new Iphone.,The Iphone not only looks great but works equally as well.  A seller that can be trusted.,[],B07759SBP7,B07759SBP7,AEQUBN5HTDPBREU7DTKA5JFGXKBA,1645803641774,0,True
5.0,Five Stars,It looked and operated like brand new. Thank you so much!!!!,[],B00NI0BPTE,B00NI0BPTE,AFZCIPZM4YXJPJKOMKMKHVKX3Y3Q,1490971327000,0,True
5.0,Like new,Phone just like new . Brand new battery and screen . No scratches,[],B07759SBP7,B07759SBP7,AEHQW5RVUTAP3JZATCXE7MXTCIXQ,1622577810750,0,True
3.0,Alright product,"It looks pretty good the only thing was it did have some minor scratches on the back, sides, and edges of front and has a mark from a different phone case that won’t go away but works well and have a good/okay battery life even came with “mint” phone plan? I don’t think it really works I put it in my phone but I don’t think I have data so? But good idea!",[],B07CQNF813,B07CQNF813,AGWZTYLECJ76IIVOZPWHVIOINZJA,1578875558157,0,True
2.0,Camera malfunctioning,Camera doesn’t work in 1x view,[],B07759SBP7,B07759SBP7,AFLCELZQHCXEPXLD4ZS4H2C42AJQ,1612029760509,0,True
5.0,Recomiendo esta conpra,Excelente producto para uso,[],B004YRBM1Q,B004YRBM1Q,AG4G4RCLGLEPJCLFHQCGWSI7AQNQ,1577641535016,0,True
5.0,Good,Everything,[],B07759SBP7,B07759SBP7,AHOWTKREZOUMJ36JEUBIEB4TWVXQ,1589420483257,0,True
4.0,Apple all the way,Like this phone,[],B07759SBP7,B07759SBP7,AF37BE5OKIBFQGBPVZAZG2RDMLJA,1574185566724,0,True
1.0,q esten desbloqueo,los telefonos son robados no los compren  estan en la lista negra,[],B09JFN8K6T,B09JFN8K6T,AHROXDQ5E5XINBTOACXDPDZ6CUYQ,1667778981813,1,True
1.0,locked device,The phone that I received was not unlocked. It did not work with T mobile (which is on the same network as AT&T). I had to get a refund.,[],B072KFCKYH,B072KFCKYH,AFSTQOFRNKK3BR4DQKYD7YZA6TXA,1582570804586,0,True
4.0,Good trade,Thank you,[],B07759SBP7,B07759SBP7,AG3WDCANQGLIRSS45MHG6LNUDCTA,1553989879630,0,True
5.0,Funciona bien,Hasta ahora funciona bien y sin problemas buen producto,[],B07759SBP7,B07759SBP7,AF3DBPOEDIV2PYKAMEAVIFCD2TVA,1623062824023,0,True
2.0,Calls disconnect all the time,Not even a yr later and the phone cuts off calls all the time,[],B07759SBP7,B07759SBP7,AHYXDSUIMHWINULJZ2PD56NZQCUA,1611131427903,0,True
5.0,Great Product,"Good product, great shape and worth the price.",[],B0B5FLX9WS,B0B5FLX9WS,AES6SFUNXC2RIVI6XX7TFX5WNF6Q,1663629515736,4,True
5.0,Great product,This phone looked and worked like new. Great product,[],B07759SBP7,B07759SBP7,AGOYX6HBLDFP3JS5JG3MN4YYYLZQ,1607636385169,0,True
4.0,Nothing wrong,[[VIDEOID:d87a332558d2aa31a9834ef5c7c15978]] Okay. So I got my phone (iPhone 6s) off of Amazon 2 years ago. I had no problem with it.. until it just got too old. So I decided to buy i new phone( iPhone 8) because i needed more storage. And boom I found this one. I was really scared to buy it because obviously on every other post it talks about how bad they are. I was scared with this one because there was no reviews. I was horriblely scared since I got my iPhone 6s and it was perfect. I have no complaints about this iphone 1 it came fast ( don’t have prime) 2 no cracks or scratches. And yes there is 256 gbs 😍 so I am just happy happy !!,"[{'small_image_url': 'https://images-na.ssl-images-amazon.com/images/I/610sZwUannL._SL256_.jpg', 'medium_image_url': 'https://images-na.ssl-images-amazon.com/images/I/610sZwUannL._SL800_.jpg', 'large_image_url': 'https://images-na.ssl-images-amazon.com/images/I/610sZwUannL.jpg', 'attachment_type': 'IMAGE'}, {'small_image_url': 'https://images-na.ssl-images-amazon.com/images/I/7107jv6hooL._SL256_.jpg', 'medium_image_url': 'https://images-na.ssl-images-amazon.com/images/I/7107jv6hooL._SL800_.jpg', 'large_image_url': 'https://images-na.ssl-images-amazon.com/images/I/7107jv6hooL.jpg', 'attachment_type': 'IMAGE'}]",B078P38R8L,B078P38R8L,AFAH5XQB6IFL2FJ7W5OZU3GXVW6Q,1583508674398,22,True
5.0,grandson happy so i am happy.,ordered for grandson. he is happier than a tick on a hounds back so far. rated overall 5 stars. rated others 3 stars because haven't had it long enough to really know the answer to them.,[],B07759SBP7,B07759SBP7,AHSY7W56I2KNLWXB4NFSQEJYXPJQ,1574100080333,0,True
5.0,I’ve had for a month and it’s great,I would buy again.,[],B00NPY1G56,B00NPY1G56,AH5LQAAAZYAAKPNCD5WJCYUYYM4A,1530251144877,1,True
1.0,I will return,"Very bad item it's alot scratch at the back, I'm not happy with it",[],B00NGOCER4,B00NGOCER4,AEBCJFDM34RKSTTQAUNB3UJNHQHA,1534773063540,0,True
5.0,great,had it for awhile and still working great!,[],B07234GKN5,B07234GKN5,AFCEWLYS6LLCV3R7YLD4NSVFVHJA,1568919579808,0,True
5.0,Refurbished is a good way to save money,Works it looks like new I love it,[],B07759SBP7,B07759SBP7,AH4NCZ7IPK3EOJDTZXRHD26QB3DA,1619020560590,0,True
1.0,Not worth it had to get fixed immediately,Was going to return but it froze and I could not even get into it to erase my info or reset the phone. So I took it to an iPhone repair store and had it fixed. They said it was not properly refurbished. The brackets that hold battery and other electric equipment in place were missing. They showed me and fixed it right then and there. I’m very upset that I went without a phone then had to pay to have my phone fixed a few weeks after I got it. No fault of my own. Was not sending a phone for a refund with all my personal info on it.,[],B07759SBP7,B07759SBP7,AHVKBC5TOP5VBZRGCQG5DQMXYJRA,1625514958533,3,True
4.0,Camera is slow to work,"Camera is slow to work, sometimes takes up to 60 seconds for an image to show up on the viewfinder. Image stabilization is amazing though",[],B085T12N5L,B085T12N5L,AEQ6M4G5U3XLWNF3MAVDO345O2JQ,1657736667515,0,True
5.0,Bueno,Bueno,[],B07B9LFNM9,B07B9LFNM9,AHYOSPFYKVYDMB7LR3ILKY5XCGIA,1560794166538,0,True
5.0,Great purchase!,Phone arrived with no scratches. Great battery life and works great. Pleased with my purchase.  Delivery was quick. Everything about this phone is as should be! Perfect!,[],B09JFP3R1D,B09JFP3R1D,AFQNFW6RNIX5AKQ77H5RD6XE3CTQ,1658882689431,3,True
5.0,Phone was in perfect condition,Awesome purchase! Phone was in perfect condition when I received it! No visual defects and functions great!! Very happy with my purchase!!,[],B07759SBP7,B07759SBP7,AE2H3P5VIJEKZAZYNPKNXZVCE34A,1581168568333,0,True
